{
  "$schema": "https://json-schema.org/draft/2020-12/schema",
  "$id": "skill_fact.schema.json",
  "title": "SkillFact",
  "description": "Step1 ingestion fact record. Japanese source facts are preserved; English keys are used for structure.",
  "type": "object",
  "required": ["record_meta", "denko_id", "name", "pool", "skill_name", "detail_url"],
  "properties": {
    "record_meta": { "$ref": "record_meta.schema.json" },
    "denko_id": { "type": "string" },
    "name": { "type": "string" },
    "pool": { "type": "string", "enum": ["original", "extra", "another", "iks", "ekico", "awamemo", "special", "collab"] },
    "skill_name": { "type": ["string", "null"] },
    "detail_url": { "type": ["string", "null"] },
    "trigger_condition": {
      "type": ["string", "null"],
      "description": "Raw Japanese trigger condition, usually from 発動条件 or 発動条件・効果."
    },
    "effect_summary": {
      "type": ["string", "null"],
      "description": "Raw Japanese skill effect summary, usually from 効果 or 発動条件・効果."
    },
    "normalized_skill": {
      "type": ["object", "null"],
      "description": "Derived semantic hints for solver use. Keep source facts in raw Japanese fields.",
      "properties": {
        "effect_kind": { "type": "array", "items": { "type": "string" } },
        "target_scope": { "type": "array", "items": { "type": "string" } },
        "trigger": { "type": "object" },
        "activation_mode": { "type": ["string", "null"] },
        "confidence": { "type": "string" },
        "review_reasons": { "type": "array", "items": { "type": "string" } },
        "available_denko_levels": { "type": "array", "items": { "type": "string" } }
      }
    },
    "skill_components": {
      "type": "array",
      "description": "Atomic solver-facing skill effects. One denko skill may contain multiple components, each with its own target, conditions, values, probability, duration, and cooldown by denko level.",
      "items": {
        "type": "object",
        "required": ["component_id", "effect_kind", "values_by_denko_level"],
        "properties": {
          "component_id": { "type": "string" },
          "effect_kind": { "type": "string" },
          "target_scope": { "type": "array", "items": { "type": "string" } },
          "target_filters": { "type": "object" },
          "trigger_conditions": { "type": "object" },
          "activation_type": { "type": ["string", "null"] },
          "condition_raw": { "type": ["string", "null"] },
          "remarks_raw": { "type": ["string", "null"] },
          "values_by_denko_level": {
            "type": "object",
            "additionalProperties": {
              "type": "object",
              "properties": {
                "value_raw": { "type": ["string", "null"] },
                "value_numeric": { "type": ["number", "null"] },
                "unit": { "type": ["string", "null"] },
                "probability": { "type": "object" },
                "duration": { "type": ["string", "null"] },
                "cooldown": { "type": ["string", "null"] },
                "skill_level": { "type": ["string", "null"] },
                "source_text": { "type": ["string", "null"] },
                "raw_row": { "type": "object" }
              }
            }
          },
          "confidence": { "type": "string" },
          "needs_review": { "type": "boolean" },
          "review_reasons": { "type": "array", "items": { "type": "string" } }
        }
      }
    },
    "activation_type": {
      "type": ["string", "null"],
      "description": "Raw Japanese アクティベーションタイプ."
    },
    "skill_remarks": {
      "type": ["string", "null"],
      "description": "Raw Japanese 備考 from the skill condition/effect table."
    },
    "lv50": {
      "type": ["object", "null"],
      "properties": {
        "skill_level": { "type": ["string", "null"] },
        "special_explanation": { "type": ["string", "null"] },
        "effect": { "type": ["string", "null"] },
        "duration": { "type": ["string", "null"] },
        "cooldown": { "type": ["string", "null"] },
        "probability": { "type": "object" },
        "raw_row": { "type": "object" }
      }
    },
    "values_by_denko_level": {
      "type": "object",
      "description": "Expanded skill-level rows keyed by denko level such as 50, 60, 70, 80, 92, 96, 100.",
      "additionalProperties": {
        "type": "object",
        "properties": {
          "skill_level": { "type": ["string", "null"] },
          "denko_level": { "type": ["string", "null"] },
          "special_explanation": { "type": ["string", "null"] },
          "effect": { "type": ["string", "null"] },
          "duration": { "type": ["string", "null"] },
          "cooldown": { "type": ["string", "null"] },
          "probability": { "type": "object" },
          "raw_row": { "type": "object" }
        }
      }
    },
    "key_level_stats": {
      "type": "object",
      "description": "AP/HP/Exp rows at key levels 1, 15, 30, 50, 60, 70, 80, and VU-only 92/96/100 when present. Default practical comparison focus is 30 and 50.",
      "patternProperties": {
        "^(1|15|30|50|60|70|80|92|96|100)$": {
          "type": "object",
          "properties": {
            "AP": { "type": ["string", "null"] },
            "HP": { "type": ["string", "null"] },
            "Exp": { "type": ["string", "null"] },
            "source_table_index": { "type": ["string", "null"] }
          }
        }
      }
    },
    "source_tables": { "type": ["object", "null"] },
    "skill_table_candidates": { "type": "array" },
    "summary_zh": { "type": ["string", "null"] },
    "note_zh": { "type": ["string", "null"] }
  }
}
