{
  "activation_type": "いつでもアクティブ",
  "denko_id": "sample:spica",
  "detail_url": "https://newekimemo.wiki.fc2.com/wiki/%E5%B0%8F%E9%B3%A5%E8%B0%B7%E3%82%B9%E3%83%94%E3%82%AB",
  "effect_summary": "(1)自身を除く先頭から1両目のでんこのDEF増加 / (2)編成内の「いつでもアクティブ」スキルを持つでんこ数に応じて発動率増加",
  "key_level_stats": {
    "1": {
      "AP": "72",
      "Exp": "0",
      "HP": "80",
      "source_table_index": "93"
    },
    "100": {
      "AP": "333",
      "Exp": "1900000",
      "HP": "315",
      "source_table_index": "93"
    },
    "15": {
      "AP": "108",
      "Exp": "7500",
      "HP": "127",
      "source_table_index": "93"
    },
    "30": {
      "AP": "147",
      "Exp": "18700",
      "HP": "168",
      "source_table_index": "93"
    },
    "50": {
      "AP": "200",
      "Exp": "36700",
      "HP": "190",
      "source_table_index": "93"
    },
    "60": {
      "AP": "234",
      "Exp": "46600",
      "HP": "221",
      "source_table_index": "93"
    },
    "70": {
      "AP": "268",
      "Exp": "57000",
      "HP": "253",
      "source_table_index": "93"
    },
    "80": {
      "AP": "302",
      "Exp": "68000",
      "HP": "285",
      "source_table_index": "93"
    },
    "92": {
      "AP": "",
      "Exp": "824000",
      "HP": "",
      "source_table_index": "93"
    },
    "96": {
      "AP": "",
      "Exp": "1252000",
      "HP": "",
      "source_table_index": "93"
    }
  },
  "lv50": {
    "cooldown": null,
    "denko_level": "50",
    "duration": null,
    "effect": "DEF +17%",
    "probability": {
      "発動率": "(1)19%"
    },
    "raw_row": {
      "コメント": "先頭車両のでんこのDEFが増加することがあります。スピカが先頭の場合は2両目が対象です。『銀河を走る鉄道は、私の永遠の憧れ！』昔読んだ本が忘れられないとのこと。ロマンチックな一面もあるのですね。",
      "スキルLv": "Lv.4 (でんこLv.50)",
      "効果": "DEF +17%",
      "発動率": "(1)19%"
    },
    "skill_level": "Lv.4 (でんこLv.50)",
    "special_explanation": "先頭車両のでんこのDEFが増加することがあります。スピカが先頭の場合は2両目が対象です。『銀河を走る鉄道は、私の永遠の憧れ！』昔読んだ本が忘れられないとのこと。ロマンチックな一面もあるのですね。"
  },
  "name": "??????",
  "pool": "original",
  "record_meta": {
    "confidence": "medium",
    "content_hash": "aad9fac29225127591174f6fad274ff825a7681f504b3d9d22b16065f42bf5be",
    "needs_review": true,
    "parsed_at": "2026-06-06T21:14:15.617900+09:00",
    "parser_version": "sample_first5_html_table_matrix.v1",
    "review_reasons": [
      "sample_parse_needs_human_review"
    ],
    "source_authority": "detail_page",
    "source_url": "https://newekimemo.wiki.fc2.com/wiki/%E5%B0%8F%E9%B3%A5%E8%B0%B7%E3%82%B9%E3%83%94%E3%82%AB"
  },
  "skill_components": [
    {
      "activation_type": "いつでもアクティブ",
      "component_id": "activation_probability_boost",
      "condition_raw": "(1)自身を除く先頭から1両目のでんこのDEF増加 / (2)編成内の「いつでもアクティブ」スキルを持つでんこ数に応じて発動率増加",
      "confidence": "medium",
      "effect_kind": "activation_probability_boost",
      "needs_review": true,
      "remarks_raw": "(2)はLv.92以上で発動",
      "review_reasons": [
        "component_semantics_need_review",
        "vu_probability_modifier"
      ],
      "target_filters": {
        "exclude_self": true,
        "position_exception_raw": "自身が先頭の場合は2両目"
      },
      "target_scope": [
        "front_car"
      ],
      "trigger_conditions": {
        "active_skill_holder_count_based": true
      },
      "values_by_denko_level": {
        "100": {
          "cooldown": null,
          "duration": null,
          "probability": {
            "発動率": "(1)25% (2)+5%～+35%"
          },
          "raw_row": {
            "コメント": "スキル名『願いが叶う瞬間 +3』",
            "スキルLv": "Lv.10 (でんこLv.100)",
            "効果": "DEF +20%",
            "発動率": "(1)25% (2)+5%～+35%"
          },
          "skill_level": "Lv.10 (でんこLv.100)",
          "source_text": "スキル名『願いが叶う瞬間 +3』",
          "unit": "percent_range",
          "value_numeric": null,
          "value_raw": "(1)25% (2)+5%～+35%"
        },
        "92": {
          "cooldown": null,
          "duration": null,
          "probability": {
            "発動率": "(1)25% (2)+1%～+7%"
          },
          "raw_row": {
            "コメント": "スキル名『願いが叶う瞬間 +1』",
            "スキルLv": "Lv.8 (でんこLv.92)",
            "効果": "DEF +20%",
            "発動率": "(1)25% (2)+1%～+7%"
          },
          "skill_level": "Lv.8 (でんこLv.92)",
          "source_text": "スキル名『願いが叶う瞬間 +1』",
          "unit": "percent_range",
          "value_numeric": null,
          "value_raw": "(1)25% (2)+1%～+7%"
        },
        "96": {
          "cooldown": null,
          "duration": null,
          "probability": {
            "発動率": "(1)25% (2)+3%～+21%"
          },
          "raw_row": {
            "コメント": "スキル名『願いが叶う瞬間 +2』",
            "スキルLv": "Lv.9 (でんこLv.96)",
            "効果": "DEF +20%",
            "発動率": "(1)25% (2)+3%～+21%"
          },
          "skill_level": "Lv.9 (でんこLv.96)",
          "source_text": "スキル名『願いが叶う瞬間 +2』",
          "unit": "percent_range",
          "value_numeric": null,
          "value_raw": "(1)25% (2)+3%～+21%"
        }
      }
    },
    {
      "activation_type": "いつでもアクティブ",
      "component_id": "def_buff",
      "condition_raw": "(1)自身を除く先頭から1両目のでんこのDEF増加 / (2)編成内の「いつでもアクティブ」スキルを持つでんこ数に応じて発動率増加",
      "confidence": "medium",
      "effect_kind": "def_buff",
      "needs_review": true,
      "remarks_raw": "(2)はLv.92以上で発動",
      "review_reasons": [
        "component_semantics_need_review"
      ],
      "target_filters": {
        "exclude_self": true,
        "position_exception_raw": "自身が先頭の場合は2両目"
      },
      "target_scope": [
        "front_car"
      ],
      "trigger_conditions": {},
      "values_by_denko_level": {
        "100": {
          "cooldown": null,
          "duration": null,
          "probability": {
            "発動率": "(1)25% (2)+5%～+35%"
          },
          "raw_row": {
            "コメント": "スキル名『願いが叶う瞬間 +3』",
            "スキルLv": "Lv.10 (でんこLv.100)",
            "効果": "DEF +20%",
            "発動率": "(1)25% (2)+5%～+35%"
          },
          "skill_level": "Lv.10 (でんこLv.100)",
          "source_text": "スキル名『願いが叶う瞬間 +3』",
          "unit": "percent",
          "value_numeric": 20,
          "value_raw": "DEF +20%"
        },
        "15": {
          "cooldown": null,
          "duration": null,
          "probability": {
            "発動率": "(1)15%"
          },
          "raw_row": {
            "コメント": "先頭車両のでんこのDEFが増加することがあります。スピカが先頭の場合は2両目が対象です。宇宙の話になると夜通し語り続けるスピカ、いつのまにかそばにいたでんこが全員爆睡している……ということも珍しくないようです。",
            "スキルLv": "Lv.2 (でんこLv.15)",
            "効果": "DEF +15%",
            "発動率": "(1)15%"
          },
          "skill_level": "Lv.2 (でんこLv.15)",
          "source_text": "先頭車両のでんこのDEFが増加することがあります。スピカが先頭の場合は2両目が対象です。宇宙の話になると夜通し語り続けるスピカ、いつのまにかそばにいたでんこが全員爆睡している……ということも珍しくないようです。",
          "unit": "percent",
          "value_numeric": 15,
          "value_raw": "DEF +15%"
        },
        "30": {
          "cooldown": null,
          "duration": null,
          "probability": {
            "発動率": "(1)17%"
          },
          "raw_row": {
            "コメント": "先頭車両のでんこのDEFが増加することがあります。スピカが先頭の場合は2両目が対象です。『スピカとは話があうんよ』ルナとは宇宙の神秘についてたびたび盛り上がっているようです。常にハイテンションなスピカですが、いったいいつ寝ているのでしょうか......。",
            "スキルLv": "Lv.3 (でんこLv.30)",
            "効果": "DEF +16%",
            "発動率": "(1)17%"
          },
          "skill_level": "Lv.3 (でんこLv.30)",
          "source_text": "先頭車両のでんこのDEFが増加することがあります。スピカが先頭の場合は2両目が対象です。『スピカとは話があうんよ』ルナとは宇宙の神秘についてたびたび盛り上がっているようです。常にハイテンションなスピカですが、いったいいつ寝ているのでしょうか......。",
          "unit": "percent",
          "value_numeric": 16,
          "value_raw": "DEF +16%"
        },
        "5": {
          "cooldown": null,
          "duration": null,
          "probability": {
            "発動率": "(1)13%"
          },
          "raw_row": {
            "コメント": "先頭車両のでんこのDEFが増加することがあります。スピカが先頭の場合は2両目が対象です。スピカが星に願いをかけると、何故か「ごく稀に」先頭車両のでんこに恩恵がもたらされるようです。成長するにつれてスピカの熱意が星に伝わるらしく、発動率とDEF増加量がアップしていきます。",
            "スキルLv": "Lv.1 (でんこLv. 5)",
            "効果": "DEF +14%",
            "発動率": "(1)13%"
          },
          "skill_level": "Lv.1 (でんこLv. 5)",
          "source_text": "先頭車両のでんこのDEFが増加することがあります。スピカが先頭の場合は2両目が対象です。スピカが星に願いをかけると、何故か「ごく稀に」先頭車両のでんこに恩恵がもたらされるようです。成長するにつれてスピカの熱意が星に伝わるらしく、発動率とDEF増加量がアップしていきます。",
          "unit": "percent",
          "value_numeric": 14,
          "value_raw": "DEF +14%"
        },
        "50": {
          "cooldown": null,
          "duration": null,
          "probability": {
            "発動率": "(1)19%"
          },
          "raw_row": {
            "コメント": "先頭車両のでんこのDEFが増加することがあります。スピカが先頭の場合は2両目が対象です。『銀河を走る鉄道は、私の永遠の憧れ！』昔読んだ本が忘れられないとのこと。ロマンチックな一面もあるのですね。",
            "スキルLv": "Lv.4 (でんこLv.50)",
            "効果": "DEF +17%",
            "発動率": "(1)19%"
          },
          "skill_level": "Lv.4 (でんこLv.50)",
          "source_text": "先頭車両のでんこのDEFが増加することがあります。スピカが先頭の場合は2両目が対象です。『銀河を走る鉄道は、私の永遠の憧れ！』昔読んだ本が忘れられないとのこと。ロマンチックな一面もあるのですね。",
          "unit": "percent",
          "value_numeric": 17,
          "value_raw": "DEF +17%"
        },
        "60": {
          "cooldown": null,
          "duration": null,
          "probability": {
            "発動率": "(1)21%"
          },
          "raw_row": {
            "コメント": "先頭車両のでんこのDEFが増加することがあります。スピカが先頭の場合は2両目が対象です。普段はしっかり者で面倒見のよいお姉さんなのですが、興味のある話になるといてもたってもいられません。最近は星占いにもハマっているようです。",
            "スキルLv": "Lv.5 (でんこLv.60)",
            "効果": "DEF +18%",
            "発動率": "(1)21%"
          },
          "skill_level": "Lv.5 (でんこLv.60)",
          "source_text": "先頭車両のでんこのDEFが増加することがあります。スピカが先頭の場合は2両目が対象です。普段はしっかり者で面倒見のよいお姉さんなのですが、興味のある話になるといてもたってもいられません。最近は星占いにもハマっているようです。",
          "unit": "percent",
          "value_numeric": 18,
          "value_raw": "DEF +18%"
        },
        "70": {
          "cooldown": null,
          "duration": null,
          "probability": {
            "発動率": "(1)23%"
          },
          "raw_row": {
            "コメント": "先頭車両のでんこのDEFが増加することがあります。スピカが先頭の場合は2両目が対象です。スピカが流れ星を見た数だけ、マスターにとっていいことが起きるようです。ここまでくるとだんだんと流れ星を見つけるのがうまくなってきます。",
            "スキルLv": "Lv.6 (でんこLv.70)",
            "効果": "DEF +19%",
            "発動率": "(1)23%"